title,date,lead,subtitle,tags,body
Patricia Bullrich se toma licencia como presidenta del PRO para la campaña,2023-04-14T10:52:17-03:00,,Otra movida en la interna macrista,"['Patricia Bullrich', 'Horacio Rodríguez Larreta', 'Interna del Pro']","['El novelón de la interna de Juntos por el Cambio llegó al capítulo en que Patricia Bullrich le arroja un guante a Horacio Rodríguez Larreta. La presidenta del PRO pidió licencia como tal para abocarse a la campaña de su precandidatura presidencial y, de esta manera, intenta marcarle la cancha a su principal oponente para que adopte una decisión similar.', 'El llamado a duelo de la exministra de Seguridad fue por Twitter, la red social sobre la cual transcurre casi todo el desaguisado de la coalición de derecha. ', '', '“Estando cerca del inicio de un proceso electoral y siendo consecuente con los valores de la verdad y la transparencia, pedí licencia a la Presidencia del PRO”, escribió Bullrich.', 'Luego cerró su enunciado con un final muy sugerente: “Ha sido un gran privilegio liderar el partido estos años”.', 'El pedido de licencia informal (se desconoce si fue notificado formalmente al partido político) para dedicarse a la campaña como precandidata presidencial\xa0le marca la cancha a cualquiera que compita para el mismo cargo, en este caso a Rodríguez Larreta.', 'Los defensores del jefe de Gobierno podrían abogar con que no es lo mismo pedir licencia para un cargo de envergadura ejecutiva que para un cargo partidario, que en definitiva es un puesto menor. Pero, sin embargo, la licencia no deja de ser un intento de mandato ético al que Rodríguez Larreta deberá responder.', '“Ética”, “valores” y “trabajo en equipo” es lo que se supone que el jefe de Gobierno transgredió con su decisión de ir a elecciones concurrentes. Así se lo enrostraron. ""No hay ambición personal que pueda estar por encima de nuestros valores y del equipo”, escribió Vidal y retuiteó Macri.', '', 'A los “valores, verdad y transparencia” apeló Bullrich, quien desde hace semanas recorre distintos puntos del país envalentonada por algunas encuestas que la posicionan con porcentajes no despreciables y muy cerca de Javier Milei. Tal vez por ello su expresión “ha sido un gran privilegio liderar el partido estos años” haga un poco de ruido.', 'Lo cierto es que la decisión pública de Bullrich es, además, un capítulo más en la interna de Juntos por el Cambio, desbocada desde el fin de semana pasado cuando el jefe de gobierno decidió llamara a elecciones concurrentes en la ciudad, desoyendo el mandato de Mauricio Macri, María Eugenia Vidal y la ¿ex? presidenta del PRO.', '\n', 'El cuestionamiento básico del tridente fue que la decisión de Larreta ponía en riesgo la candidatura definitiva de un exponente del PRO en la Capital Federal, como el caballo del comisario Jorge Macri, y le abría el juego al radicalismo en la figura de Martín Losteau.']"
Especialistas expusieron sobre el proyecto de ley que beneficiará a la producción orgánica,2023-04-14T10:48:55-03:00,,Trabajo legislativo,['Diputados'],"['Se dio en el marco de la comisión de Economías y Desarrollo Regional, que preside el diputado nacional Ramiro Fernández Patri (FdT). En la reunión participó como invitada la Comisión Asesora para la Producción Orgánica, que funciona dentro de la estructura la Secretaría de Alimentos, Bioeconomía y Desarrollo Regional.', 'Al dar la bienvenida a la jornada, Fernández Patri señaló que “estamos avanzado en un proyecto de ley que genere posibilidades para revertir las asimetrías que tiene la Argentina, mediante la producción orgánica, que contribuye a empleos de inclusión”. En esa línea, detalló: “La norma propone un fondo que brinde financiamiento para asistencia técnica a la producción orgánica”.', 'Pablo Morón, director de Agregado de Valor y Gestión de Calidad, de la Secretaría de Agricultura, Ganadería y Pesca, resaltó que “la producción orgánica está diseminada y es sumamente federal, tiene un potencial enorme, el cual se visibilizó aún más a partir de la pandemia y viene creciendo año tras año”. “Este instrumento de políticas públicas va a traccionar mucho más a la producción orgánica”, puntualizó.', 'Luego, Rocío Leiva, directora provincial de Certificación, Comercialización y Agricultura Sostenible de la provincia de Catamarca, consideró “fundamental y necesario el proyecto de ley para continuar con el apoyo a los productores y contribuir al crecimiento económico de la provincia, que apunta al fortalecimiento del sector promoviendo el consumo interno, trabajando y educando a los consumidores”.', 'El productor de vid y elaborador de vino orgánico, Oscar Andreatta, desde la misma provincia, afirmó que “es una herramienta para potenciar y que nos ayude a producir más, mejor y con mayor valor agregado”.', 'En representación de la mesa regional de la Patagonia Norte, el ingeniero agrónomo Pablo de Azevedo, subsecretario de Fruticultura de Río Negro, se manifestó a favor del proyecto con beneficios impositivos al ponderar “la promoción del mercado interno, principalmente para que se diversifique la producción orgánica, que hará que los productores no salgan de la producción orgánica”.', 'Sebastián Garrido, director de Productores Argentinos Integrados S.A, una ley como nos puede beneficiar no solamente al productor o al comercializador, sino que está beneficiando a la comunidad entera. La técnica Griselda Capli, del área de Producción Orgánica del ministerio de Agro y Producción de la provincia de Misiones, sostuvo que “con los fundamentos que tiene la ley vamos a seguir trabajando e impulsando la actividad”.', 'El ingeniero agrónomo Pablo Chipulina, coordinador Apícola del Ministerio de Producción, Industria y Empleo de la provincia de Chaco, sostuvo que “creemos fundamental la aprobación de esta ley para garantizar la sostenibilidad de los procesos de producción orgánica, para generar los ambientes en los cuales se debe generar las producciones orgánicas o conservarlos”.', 'En tanto, María Rosa Barbarán, decana de la Facultad de Ciencias de la Salud en la Universidad Católica de Santiago del Estero, celebró que “una herramienta como esta ley permitiría beneficios de rentabilidad fiscal”. El maestro mayor de obras Darío Ortiz, presidente del Movimiento Argentino para la Producción Orgánica, expresó que “venimos a empujar para que salga esta ley, ya que aparte de ser rentable para el productor tiene que haber cuidado del medio ambiente, que es una de las bases de la producción orgánica”.', 'Por último, el ingeniero agrónomo Gabriel Berardinelli, presidente de la Cámara Argentina de Certificadoras (CACER), remarcó que “la iniciativa busca seguir un proceso de construcción de la argentina orgánica”. En ese sentido, les solicitó a los legisladores que apoyen la ley para “seguir fortaleciendo el sector orgánico”.', '']"
Más soluciones habitacionales para La Pampa y Santa Fe,2023-04-14T10:32:54-03:00,,Gestión del Ministerio de Desarrollo Territorial y Hábitat de la Nación,"['La Pampa', 'Santa Fe', 'Plan de viviendas']","['El ministro de Desarrollo Territorial y Hábitat, Santiago Maggiotti, arribó este miércoles a la ciudad de Toay para entregar junto al gobernador de La Pampa, Sergio Ziliotto, y al intendente local, Rodolfo Álvarez, viviendas a familias de esa localidad. Durante la jornada, además, se anunció la construcción de 480 hogares más en Santa Rosa y General Pico.', 'Maggiotti y Ziliotto, junto al secretario de Coordinación del Ministerio de Desarrollo Territorial y Hábitat, Marcos Aguilar y al presidente del Instituto Provincial Autárquico de Vivienda (IPAV), Jorge Lezcano, encabezaron esta tarde un acto donde 40 familias del mencionado municipio pampeano recibieron las llaves de su flamante hogar. Además, en el marco del Programa Federal Casa Propia, el ministro le entregó al gobernador la autorización administrativa para avanzar con la construcción de 280 viviendas en Santa Rosa, y juntos suscribieron un convenio por el cual se ejecutarán otras 200 unidades en la localidad de General Pico.', 'Durante el acto, Maggiotti expresó: “Hoy estamos aquí cumpliendo la palabra empeñada de brindar soluciones habitacionales en todo el país, con un Estado presente, que piensa en igualar oportunidades en el acceso no sólo a la vivienda, sino también a la salud y la educación, para que todos los argentinos sean ciudadanos de primera”. Y seguidamente señaló: “Nuestro compromiso es que casa que se entrega, casa que se empieza a construir, porque eso genera empleo y reactivación económica gracias a la mano de obra y al mercado de los materiales”.', 'Ziliotto, mientras tanto, afirmó: “Vamos a seguir trabajando día a día por la dignidad, la inclusión y la igualdad, construyendo viviendas a través de la consolidación de este círculo virtuoso que se genera por la solidaridad entre pueblo y gobiernos”. Y en el mismo sentido, Álvarez aseveró: “No hay mejor manera de que trabajemos en forma conjunta los estados Nacional, provincial y municipal, para dar una solución integral en las políticas públicas, que esta que brinda bienestar, equidad y seguridad a las familias pampeanas”.', 'Cabe destacar que en La Pampa, el Ministerio de Desarrollo Territorial y Hábitat de la Nación otorgó hasta el momento casi 2 mil soluciones habitacionales, gracias a una inversión de más de $ 17.500 millones, mientras que se encuentran en ejecución otras más de 2.500, con un financiamiento que supera los $ 28.075 millones.', 'Por su parte, la secretaria de Hábitat nacional, Micaela Villaverde, viajó a la provincia de Santa Fe para entregar en la localidad de Florencia 20 viviendas del Programa Federal Casa Propia junto al intendente local, Rubén Quain, la ministra de Infraestructura, Servicios Públicos y Hábitat provincial, Silvina Frana y el secretario de Hábitat, Urbanismo y Vivienda de Santa Fe, Amado Zorzón.', 'Durante el acto, Villaverde destacó: ”Este es un trabajo en conjunto entre el Estado Nacional, el provincial y el municipal que, trabajando codo a codo, quiere y puede mejorarle la calidad de vida a nuestros vecinos y vecinas. Hoy acá estamos dando un ejemplo de eso”.', '\n', 'Además, la funcionaria nacional le entregó al gobierno municipal la autorización administrativa que le permitirá avanzar con la construcción de 36 viviendas en el barrio Itatí, que se construirán gracias a un financiamiento nacional de más de $441 millones.']"
Sabbatella: “Tenemos la obligación democrática de romper la proscripción”,2023-04-14T00:10:34-03:00,,,['Morón'],"['Nuevo Encuentro participó este jueves junto a diversos espacios políticos, sociales y sindicales de la convocatoria a Tribunales bajo el lema ""Democracia o mafia judicial"" que exige la renuncia de los miembros de la Corte Suprema de Justicia y el fin de la proscripción a Cristina Kirchner.', '“Estamos donde tenemos que estar, en esta histórica concentración en Tribunales junto a miles de compatriotas. Tenemos la obligación democrática de romper la proscripción. En Argentina hay una guerra judicial contra la política que busca suprimir la voluntad popular y la máxima expresión de eso es la proscripción a Cristina”, aseguró el presidente de Nuevo Encuentro, Martín Sabbatella.', '“La mafia judicial, colonizada por el poder real, hace un enorme daño en nuestro país, degrada las instituciones democráticas, persigue dirigentes políticos del campo nacional y popular y genera los escenarios para que haya más desigualdad y pobreza. Tenemos una Corte Suprema que toma por asalto el Concejo de la Magistratura o hace favores a sus amigos del PRO en la Coparticipación, es una situación muy grave”, agregó.', '“Si queremos una Argentina inclusiva, que no deje a los sectores populares a la intemperie, está claro que no será con esta “dictadura de los jueces”. La lucha debe darse en las calles, con más participación ciudadana. También tenemos la obligación democrática de romper la proscripción impuesta contra Cristina”, finalizó Sabbatella.', '', '']"
"""Democracia o mafia judicial"": Una multitud pidió que se levante la proscripción a CFK",2023-04-14T00:01:00-03:00,"Frente a los tribunales, organizaciones políticas, sociales y sindicales se movilizaron contra el lawfare y en apoyo a una candidatura de Cristina Fernández de Kirchner. ""Si ella quiere, el pueblo la va a acompañar y va a volver a ejercer cargos”, dijo el gobernador Axel Kicillof, en el discurso de cierre. Con un documento, los organizadores exigieron que sean removidos los magistrados involucrados en el escándalo del Lago Escondido y que termine la persecución político judicial, además de exigir la dimisión de los jueces supremos. ",Los manifestantes reclamaron la renuncia de todos los miembros de la Corte Suprema,"['Cristina Fernández de Kirchner', 'Corte Suprema de Justicia', 'Axel Kicillof', 'Hugo Yasky']","['El kirchnerismo volvió a poner el pie en el acelerador para reforzar el operativo clamor para que Cristina Fernández de Kirchner sea la candidata a presidenta del peronismo. Bajo el lema ""democracia o mafia judicial"", una masiva movilización en la Plaza Lavalle, frente a los tribunales, pidió que se levante la proscripción contra la vicepresidenta. El discurso que cerró la manifestación estuvo a cargo del gobernador bonaerense, Axel Kicillof: ""Vamos a llenar las urnas de votos y vamos a romper la proscripción para que Cristina decida. Si ella quiere, el pueblo la va a acompañar y va a volver a ejercer cargos”, dijo ante la multitud convocada por el PJ bonaerense y el porteño, otras organizaciones políticas, sociales y sindicales.\xa0', 'En el documento que leyeron los organizadores, exigieron la renuncia de todos los miembros de la Corte Suprema, que los jueces y camaristas involucrados en el episodio de Lago Escondido\nsean inmediatamente removidos por el Consejo de la Magistratura, y que cese de\ninmediato la persecución político judicial y la proscripción. La candidatura de CFK es hoy ""el único plan posible"" del oficialismo, le dijo a Página/12 un dirigente kirchnerista al finalizar el acto', 'Kicillof, ovacionado por el público, fue el último en hablar. Se acercó al estrado y remarcó que el Poder Judicial ""no da respuestas a nuestro pueblo"". ""Este Partido Judicial también impide que se cumplan los derechos más básicos. Nos afecta con sus fallos todos los días. Estos jueces nunca dijeron nada contra el préstamo del FMI que se tomó ilegalmente y nunca se enfrentaron a los poderes concentrados"", dijo y sentenció: ""No son independientes. Son un instrumento de los poderes concentrados"". En esa línea, el gobernador agregó que ""este año se va a elegir de nuevo entre la derecha y los derechos. Con esta Corte nuestros derechos no están garantizados. Vamos a llenar las urnas de votos y vamos a romper la proscripción contra CFK"".', 'La jornada comenzó cerca de las 15, cuando las columnas de La Cámpora, la CTA y distintas agrupaciones sociales, sindicales y políticas comenzaron a avanzar por la 9 de Julio para llegar a la Plaza Lavalle. Muchos de ellos lo hacían cantando, con banderas de sus organizaciones o con carteles confeccionados para la ocasión. Al lado del cartel que siempre lleva La Cámpora, había otro con las mismas letras blancas que decía ""Cristina 2023"" y también una foto de la vicepresidenta gigante, que fue prolijamente recortada y puesta sobre cartón. Además de carteles en respaldo a CFK, había varios en contra del Poder Judicial. Uno tenía la foto de los supremos y abajo consignaba: ""que se vayan"".', 'En el escenario, además de Kicillof, estuvieron la diputada Vanesa Siley; el secretario general de la CTA, Hugo Yasky; las Madres de Plaza de Mayo y los referentes que se juntan hace meses en Ensenada: Mario Secco, intendente de esa localidad; los ministros bonaerenses Andrés Larroque, Cristina Álvarez Rodríguez y Walter Correa; la vicegobernadora, Verónica Magario; los sindicalistas Roberto Baradel y Omar Plaini; el ministro de Cultura, Tristán Bauer; otros intendentes como Fernando Espinoza, de la Matanza; Mariel Fernández, de Moreno, y Jorge Ferraresi, de Avellaneda; y, entre otros, el diputado Leopoldo Moreau.\xa0Uno de los últimos en llegar fue el ministro del Interior, Eduardo de Pedro, que se ubicó en primera fila al lado de Kicillof.\xa0', 'También tuvieron un lugar protagónico en el escenario las Madres del Dolor y otros familiares de víctimas que piden justicia, como Osvaldo Balossi, sobreviviente de Cromañón; Ignacio Politzer, hijo de las víctimas de la tragedia de Austral; Marta Ramallo, madre de Johana Ramallo, víctima de trata, y Doly Sygampa, madre de Ezequiel Demonty, entre otros.', 'Hubo ausencias que llamaron la atención como la de Máximo Kirchner, presidente del PJ bonaerense —que había convocado a la marcha en la última reunión del partido—, y las de intendentes como Martín Insaurralde, de Lomas de Zamora. En sus entornos explicaron que estuvieron en un encuentro en Monte Hermoso con mandatarios de la Sexta Sección.\xa0', 'Durante su discurso, Kicillof, hizo un repaso de la historia reciente y de los golpes de Estado que sufrió el país, empezando por el de 1930, y recordó: ""No hace falta recuperar la historia del país para saber que el partido militar siempre fue un instrumento de las élites para terminar con los procesos populares"", dijo. Luego agregó que ""la guerra judicial les ha servido para intentar gobernar a través de fallos. Cuando no tienen los votos tienen los fallos y sentencias. Esto se tiene que terminar. No podemos vivir con una democracia de rodillas"".\xa0', 'El gobernador recordó que la violencia contra la vicepresidenta se vio incrementada desde el pasado 1º de agosto cuando comenzó ""la saga televisiva donde jueces y fiscales leyeron"" primero la acusación y luego la sentencia contra CFK en la causa Vialidad. Al mismo tiempo —añadió— ""empezaron a sucederse hechos de violencia que desembocaron el 1º de septiembre en el atentado"". ""Creían que con la sentencia no iba a alcanzar y por eso intentaron atentar contra la vida de CFK"", resaltó y cuestionó que el Poder Judicial no investigue a los autores intelectuales del intento de magnicidio. ""Tenemos paciencia y somos pacíficos, pero no somos tontos. Esto se tiene que acabar"", subrayó. Kicillof también se tomó un momento para apuntar contra Mauricio Macri. ""No se bajó de su candidatura por un acto de falta de egoísmo. Lo bajó el pueblo en 2019 cuando no lo votó y ahora porque no lo pensaba votar"", dijo.', 'Hugo Yasky también habló de la oposición cuando comentó que el día anterior había visto los discursos de los seis precandidatos que se presentaron en la Sociedad Rural: ""Veía a los candidatos de la oposición compitiendo a ver quién prometía más hambre y más ajuste para poner más plata en las manos de los dueños del capital económico"", dijo e hizo un paralelismo: ""Esa vergüenza choca contra nuestro pueblo, que hoy está en la calle"", remarcó. La persecución a CFK, opinó ""es para disciplinar a este pueblo que desde Perón y Evita nunca les soltó la mano a sus líderes"".\xa0', 'Yasky estuvo con CFK en el Senado el miércoles. Fue junto con Siley y otros sindicalistas. Contó que la vicepresidenta les dijo: ""Los que están pensando que me voy a dedicar a cuidar a mis nietos, mejor que se olviden"", y eso despertó las esperanzas de varios de los que hoy estaban frente a Tribunales. En el estrado, Yasky dijo que él iba a hablar en representación del movimiento obrero ""que nunca se arrodilló ante los poderosos"" y pronunció: ""Queremos un pueblo con educación, trabajo y con derechos y por eso queremos la libertad de nuestra líder para que pueda ser nuestra candidata a presidenta"".', 'Por último, tiró un dardo en dirección a Casa Rosada. ""Así como se garantizan los dólares, tenemos que pedirle al Gobierno que garantice los pesos para que todas las familias lleguen a fin de mes"", dijo. Siley, que lo siguió en el uso de la palabra, continuó con las críticas al sector del peronismo contra el que, posiblemente, el kirchnerismo vaya a internas. ""Nuestro sector construyó la mayoría que empujó a una conformación más grande para llegar al gobierno en 2019. Con ese derecho discutimos las políticas del Gobierno y por eso decimos que queremos que se recomponga el salario con suma fija y que se rediscuta el acuerdo con el FMI"", reclamó.']"
