title,date,lead,subtitle,tags,body
"En mayo se hará el juicio al cura Páez, por abuso sexual",2023-04-13T01:08:25-03:00,Las audiencias están previstas desde el 15 al 18 de mayo en la ciudad de Tartagal. El Instituto Laico de Estudios Contemporáneos de Argentina (ILEC) junto al denunciante exigen medidas de protección. ,Reclaman medidas de seguridad para la víctima,"['Abuso sexual eclesiástico', 'Carlos Páez']","['El juicio al cura Carlos Fernando Páez, acusado por abuso sexual en perjuicio de un exseminarista, comenzará el próximo 15 de mayo en Tartagal. En este contexto, el\xa0Instituto Laico de Estudios Contemporáneos de Argentina (ILEC), junto al denunciante, exigieron medidas de protección para él y su familia.', 'Páez está imputado por abuso sexual simple doblemente agravado por haber sido cometido en su rol de ministro de culto reconocido y encargado de la educación.', 'Las audiencias de debate estarán a cargo de\xa0la Sala I del Tribunal de Juicio de Tartagal, integrado por los jueces Ricardo Martoccia y Aníbal Burgos y la jueza Soledad Rodríguez.', 'Está previsto que la Unidad Fiscal que conforman\xa0Pablo Cabot (de Tartagal) y Cecilia Flores Toranzos junto Sergio Federico Obeid (de la Ciudad de Salta), que trabajó en la investigación penal preparatoria, lleve la acusación también en el juicio.\xa0', 'Páez se desempeñaba en la parroquia La Santa Cruz de Villa Saavedra, en Tartagal, dependiente de la diócesis de Orán. Fue denunciado en julio de 2019 por el exseminarista Kevin Montes,\xa0quien decidió hacer pública su identidad. El joven relató hechos de abuso cometidos en contra de su integridad sexual entre 2015 y 2017.', 'Lxs fiscales señalaron que los elementos colectados en la investigación penal preparatoria ""revelan que el relato del denunciante no es aislado y desprovisto de sustento, sino que se corresponde con las manifestaciones de testigos que ocuparon roles diversos en la iglesia donde se desempeñaba el acusado, que dan cuenta de un modus operandi desplegado por parte del religioso"".', 'Cabot se comunicó con el denunciante este miércoles para informarle que el juicio comenzará el próximo 15 de mayo y se extenderá hasta el 18 del mismo mes. Están citados a declarar más de 30 personas, por lo que se prevé que ante cualquier percance, las audiencias puedan prolongarse por más días.\xa0\xa0', '""Quiero mis garantías, tanto para mí como para mi familia. No me siento seguro ni física ni psicológicamente por el hostigamiento de la gente. Tengo miedo del viaje tanto de ida como de vuelta"", manifestó Montes a Salta/12. El joven se mudó de Tartagal a Córdoba como consecuencia de la revictimización a la que fue sometido por denunciar al cura. Mediante una segunda comunicación telefónica el fiscal le aseguró que va a garantizarle medidas de protección.', 'Montes espera que en este juicio ""no pase lo mismo que con (el obispo emérito Gustavo) Zanchetta"", que obtuvo una condena por abuso sexual en perjuicio de dos exseminaristas de cuatro años y medio de prisión efectiva, pero que luego devino en domiciliaria. El joven fue un testigo clave en esa causa, en la que relató que fue víctima del obispo pero que no llegó a denunciarlo por las dificultades de sobrellevar dos procesos judiciales.\xa0', 'Respecto al juicio contra Páez, el denunciante exigió ""cárcel común, sentencia firme y coherente"". ""Esto no es sólo por mí, sino por otros testigos que no se animaron a denunciar, pero sufrieron lo mismo y van a declarar, y por los que pudieron haber sido víctimas si esto no se denunciaba"", expresó.', 'El representante en Salta del Instituto Laico de Estudios Contemporáneos de Argentina, Fernando Climent, dijo a Salta/12 que acompañarán a la víctima en el juicio y también lo hará la Red Nacional de Sobrevivientes de Abuso Sexual Eclesiástico.', 'El ILEC emitió un comunicado manifestando preocupación por la falta de garantías de la seguridad del denunciante.\xa0', '""Nos preocupa primero la seguridad (de la integridad) física y emocional de Kevin"", señaló Climent. Por ello, desde el ILEC exigen que se asigne custodia policial al denunciante y a sus familiares, y también un servicio de transporte con chofer para el traslado desde el hospedaje hasta el lugar del juicio.', '""Nos preocupa el modo de operar del Poder Judicial. No pudimos presentar querellante ni amicus curiae porque nunca le informaron (a la víctima) los plazos"", manifestó Climent. Su organización también exigió ""garantías de una condena ejemplar, de cárcel común y un juicio justo"".\xa0', 'Climent resaltó que el año pasado el ILEC y la Red Nacional de Sobrevivientes tuvieron que exigirle al fiscal de Tartagal que reciba al denunciante, le explique el proceso judicial y le brinde una copia del expediente.\xa0', 'Además, el referente señaló que al inicio de la causa, el denunciante pidió que no interviniera la fiscala de Tartagal Lorena Martínez, porque era cercana al cura y catequista en su parroquia. Sin embargo, después la funcionaria y Cabot, fiscal de la causa, se casaron, y esto generó el temor de que hubiera parcialidad en favor del sacerdote.\xa0', 'El denunciante pedía que la Fiscalía le garantizara imparcialidad, cuando se reunió el año pasado con el fiscal y con su auxiliar\xa0Josefina Calvo, se comprometieron a ello. Cabot le dijo que no era amigo del cura denunciado y consideró que no debía inhibirse.', 'Climent también advirtió que la fecha de inicio del juicio coincide con el día después de las elecciones generales en la provincia, lo que va implicar que pase desapercibido en los medios que van a centrar la agenda en la cobertura de los comicios. Ante ello, planteó desde el ILEC la exigencia de que se permita la presencia de periodistas en las audiencias, para garantizar la publicidad del proceso.', 'Montes pidió ""empatía a la sociedad"", respecto a las causas por violencia sexual. ""Siempre la víctima es (juzgada) como culpable, nadie ve que todos podemos haber vivido un abuso sexual, y que éste no siempre es como creemos, no necesariamente tiene que haber acceso carnal para decir a mí me abusaron"", manifestó.\xa0', 'Ante el avance de la causa penal, en agosto de 2022 el obispo de Orán, Luis Scozzina, suspendió de forma cautelar al cura Páez del ejercicio ""público"" del ministerio del sacerdocio y también dispuso que no podrá seguir residiendo en la Parroquia Nuestra Señora de la Merced, de localidad de La Unión, en el departamento Rivadavia, hasta que se resuelva su situación procesal.\xa0', 'Montes consideró ""tardía"" la medida de Scozzina, pero además denunció un ""abandono total de la iglesia como institución"". Recordó que la denuncia canónica data del 12 de septiembre de 2019 y no tuvo más novedades. El exseminarista también señaló que Páez tenía una denuncia canónica previa de otra víctima en Orán.\xa0', '""Páez siguió trabajando con jóvenes vulnerables del Hogar de Cristo en La Unión, yo sentía como que el obispo y el cura se me estaban burlando en la cara"", dijo el denunciante.', 'Para finalizar, Montes relató que en Tartagal lo catalogaron de ""anticlerical"" por la denuncia que realizó. ""No estoy en contra de la Iglesia, sino que creo necesario que este tipo de curas sea apartado de la institución porque la daña. Esta gente debería ser juzgada y apartada porque le hace daño a la sociedad. No está bueno que la Iglesia siga permitiendo este tipo de cosas. Esto es para frenar los abusos"", sostuvo. ']"
Jujuy: comienza el juicio por el femicidio de Iara Rueda ,2023-04-13T01:08:06-03:00,"Es uno de los casos emblemáticos de la provincia. Además de que en septiembre de 2020, en plena pandemia, hubo cinco femicidios en Jujuy, en el caso de Iara se suman las irregularidades cometidas por los policías que debían buscarla.  ",El tribunal restringió la presencia del público y la prensa ,"['Iara Rueda', 'femicidio', 'juicio']","['En el palacio de Tribunales de Jujuy, a las 8.30 de hoy, se iniciará el juicio a los tres hombres acusados por el femicidio de la adolescente Iara Rueda. El Tribunal en lo Criminal N° 3, integrado por las juezas María Margarita Nallar y Ana Carolina Pérez Rojas y el juez Mario Ramón Puig,\xa0dispuso restricciones para la prensa a pesar de ser un juicio oral y público. Antes de esta determinación la familia Rueda había solicitado expresamente que se permita el acceso de la prensa.', 'El abogado Julián Martín Palmieri, que junto a Agustina Reyna representa a la querella del padre y la madre de Iara Rueda,\xa0Juan José Rueda y Mónica Cunchila,\xa0solicitó que se brinden las condiciones para que el periodismo pueda realizar la cobertura periodística. “Presenté un escrito para que se habilite el Salón Vélez Sarsfield para que los medios puedan transmitir este juicio oral y público”, sostuvo el letrado.', 'En este sentido la Multisectorial de Mujeres y Disidencias de Jujuy exigió que “el juicio oral por el femicidio de Iara sea público conforme a derecho y no a puertas cerradas, que la comunidad sea testigo a través de la prensa”.', ' ', 'El Tribunal dispuso que la prensa solo podrá filmar y tomar fotografías al inicio de cada audiencia y el día de sentencia. En la resolución ratifica que se trata de un juicio público pero inmediatamente pone límites a la publicidad. “Es sabido que los juicios en nuestro país son orales y públicos, características propias de los actos de gobierno de un estado republicano como el adoptado por nuestro país y previsto en el Art 1 de la Constitución Nacional"", sostuvo. Pero enseguida agregó que “Si bien todo sistema republicano exige sin duda que el proceso penal en su faz de juicio se desarrolle en forma pública, no es lo mismo que pretender a ultranza una publicidad sin limitación alguna"", lo cual consideró que ""no es adecuado para los derechos individuales del imputado ni para los fines del proceso”. ', 'Iara Rueda tenía 16 años cuando desapareció, el 23 de septiembre de 2020, en la ciudad de Palpalá, a 15 kilómetros de la capital jujeña, San Salvador. La chica había salido a dejar una tarea el 23 de septiembre y estuvo desaparecida por 5 días, hasta que se encontró su cuerpo sin vida. A pesar de que familia denunció la desaparición en la Policía, no se activó el protocolo de búsqueda con la urgencia por tratarse de una menor de edad.', 'La propia familia y vecinos y vecinas buscaron a Iara, y fue hallada cinco días después, en un descampado.\xa0', 'Los imputados son Raúl Arnaldo Cachizumba y Mauricio Esteban Abad, quienes serán juzgados por “homicidio doblemente agravado calificado por alevosía y por ser cometido en contra de una mujer”. El tercer acusado es Tomás Fernández, de 19 años pero que en el momento\xa0del hecho tenía 16 años, quien también está imputado por “homicidio triplemente agravado, por el vínculo, alevosía y por ser cometido contra una mujer”. ', 'Por otro lado, por las falencias en el proceso iniciado tras la denuncia por la desaparición de Iara, su familia denunció formalmente a ocho policías por abandono de persona.', 'El juicio oral llega después de dos años y medio de reclamos y pedidos insistentes de Mónica Cunchila y Juan Rueda para que el proceso avance.\xa0', 'A comienzos de este año judicial, hubo una audiencia preliminar preparativa de este juicio y se había notificado a la familia que el debate iba a comenzar el 17 de agosto. La noticia provocó mayor dolor a la familia de la adolescente, que cuestionó la lentitud de la administración de justicia y el hostigamiento del estado provincial.', 'En ese escenario el fiscal Alejandro Bosatti\xa0presentó un recurso de queja por “retardo y denegación de justicia”, por considerar la fecha prevista para el inicio del debate, como “sumamente lejana e irrazonable”. La jueza Nallar hizo lugar a este recurso y se anticipó la fecha, por lo que comenzará hoy.', 'En estos años, Mónica Cunchila viene realizando marchas los martes (día de la desaparición de su hija)\xa0 en la capital provincial y en Palpalá. Esta movilización provocó que familiares de otras personas víctimas de femicidios y homicidios se sumen para reclamar justicia y visibilizar estos casos.', 'En uno de esos días de lucha, Mónica fue multada con una contravención por el gobierno de Gerardo Morales y la obligaron a retirar sus carteles de la Casa de Gobierno.', 'El pasado 8 de marzo la madre y otras mujeres fueron reprimidas cuando marchaban contra la violencia de género y derecho de las mujeres y disidencias.', 'Para la audiencia de hoy está previsto que además de la lectura de la acusación penal declaren diez personas. En todo el proceso declararían 60 personas. Si se cumpla el cronograma previsto, el 8 de mayo sería la última audiencia, un día después de las elecciones provinciales en la provincia.\xa0', 'La realización de los debates orales en casos de femicidio en esta época preelectoral genera suspicacias en las familias. ""Le pediría al gobernador que por un ratito se ponga en el lugar de papá, no como gobernador solo como papá. Él o ellos están llevando esto a un lugar político, no nosotros. Nosotros queremos justicia”, recalcó Mónica Cunchila en declaraciones públicas.', 'Y aclaró que las manifestaciones seguirán: “Quizás crean que con hacer los juicios no estaremos más en las calles, por lo menos de mi parte voy a seguir. Nos queda el caso de Cesia, Paulina Flores (Santa Catalina), Marcela Balderrama (La Quiaca), Dafne Soto (Humahuaca),\xa0creerán que nos vamos a quedar tranquilos y son muchos casos. Capaz sea para callarnos”, dijo.\xa0', 'En lo que va de este año ya se realizaron los juicios por los primeros femicidios de 2020 y el doble femicidio de Yuto, cometido en abril de 2022; el de Camila Peñalva y de Nahir Álvarez. Todos estos casos provocaron la declaración de la emergencia en violencia de género en la provincia.\xa0En octubre de 2020, la provincia de Jujuy aprobó la Ley N° 6186, Ley Iara, que declara la emergencia en materia de violencia de género, una norma que fue construida con la sociedad y cuyo objetivo principal es revertir el número de mujeres y personas LGBTIQA+ en situación de violencia de género. Sin embargo, organizaciones de mujeres y disidencias, y familiares de víctimas, vienen sosteniendo que el prespuesto destinado es insuficiente. La emergencia se dictó en 200 por dos años y en 2023 se prorrogó por otro año.', 'En el juicio que comenzará hoy también participará el Consejo Provincial de la Mujer, en representación del Estado provincial, con la presencia de la abogada Miriam Valdez y el abogado Leonardo Fernández. La letrada Sara Cabezas estará a cargo de la defensa del acusado más joven, que era menor de edad al momento del hecho. Los abogados Gustavo Reynoso y Agustín Reynoso defenderán a Cahizumba, y Mauricio Abad será asistido por los abogados Antonio Manuel Vargas y Jorge César Soria.']"
Edesa no podrá cobrar intereses moratorios a usuarios de Orán y San Martín,2023-04-13T01:07:47-03:00,La resolución del Enresp se tomó tras recibir quejas de usuarios y usuarias por facturas en las que se incluye el cobro de intereses por mora. ,Decisión del Ente Regulador de Salta ,"['EDESA', 'Energía eléctrica', 'Ente Regulador de los Servicios Públicos', 'Orán', 'San Martín']","['El Ente Regulador de los Servicios Públicos de la Provincia de Salta (Enresp) emitió en la tarde ayer la resolución 435/23, por la que prohibe a la prestadora del servicio de energía eléctrica, EDESA SA, el cobro de intereses por mora a los usuarios de los departamentos de Orán y San Martín, que se encuentran amparados por el artículo 1 del decreto provincial 38/23 y la resolución del Ente Regulador 84/23.\xa0', 'En el decreto 38 estableció de forma expresa que los usuarios y usuarias de ambos departamentos solamente deben abonar un ""monto equivalente a la facturación del periodo noviembre 2022"" durante el plazo de 180 días. ""De allí que no corresponde autorizar o consentir que EDESA S.A. cobre rubros o montos adicionales con independencia de su naturaleza y concepto durante ese período"", señala la resolución 435, que se publicará hoy en el Boletín de la Provincia de Salta.\xa0', 'En ese sentido, el presidente del Ente Regulador, Carlos ""Uluncha"" Saravia, indicó a Salta/12 que ""aparecieron facturas donde EDESA cobra intereses moratorios por la demora de la gente"". Si bien dichos montos fueron facturados de forma ""correcta"", puesto que la prestataria no recibió el pago de la factura en tiempo y forma, Saravia dijo que este retraso se debió a dos razones puntuales.', 'Por un lado, la situación socioeconómica de las familias, porque ""no tenían plata"" para abonar la factura del servicio eléctrico. En la misma resolución, el Ente reconoce que se trata ""un gran conglomerado de usuarios"" que no puede asumir tal costo, lo que también resultó ser la base de las medidas adoptadas por el gobernador Gustavo Sáenz, y el organismo de control, como es el caso de la instauración del régimen de tarifa diferencial por zona cálida durante 4 meses en algunos departamentos de la provincia.\xa0', 'La segunda razón se debe ""a la gente del acampe"", que se colocó en las puertas de la oficina que EDESA tiene en el municipio de Orán. Según Saravia, ""no se permitía el paso y la gente no podía pagar"" por las ""medidas de fuerza adoptadas por particulares que comprometieron el normal funcionamiento"" de la dependencia, ""obstaculizando el ingreso por más de 60 días a usuarios con voluntad de pago oportuno"".\xa0', 'El acampe se instaló en Orán tras el fuerte incremento en las facturación correspondiente a diciembre del año pasado, lo que ocasionó una serie de manifestaciones desde mediados de enero por un sector que se reconoce como Vecinos Autoconvocados. Una de sus acciones fue precisamente instalar un acampe al frente de la oficina de la empresa.\xa0', 'Para el Ente Regulador, esta acción incluyó un ""asesoramiento de los protestantes"" que ""instruían públicamente a no pagar el servicio"", lo que ""indujo al error a usuarios que se sintieron autorizados a no cumplir con las nuevas fechas de vencimientos dispuestas en el marco de las medidas que se dictaron con posterioridad a la distribución de las facturas del mes de diciembre"", se señala en la reciente norma.\xa0', 'Tras los reclamos que de usuarios y usuarias por las deficiencias en el servicio y las altas subas de las tarifas -y que aún se sostienen en el norte salteño-, el gobernador Sáenz emitió el decreto 38/23, por el que se retrotrajo a los valores de noviembre de 2022 el monto de la boleta de luz por los seis meses a usuarios y usuarias de Orán y San Martín. El decreto también estableció que sólo serán incluidas como beneficiarias aquellas personas que estén comprendidas en los niveles 2 (hasta $152.515) y 3 (hasta los $533.802) de la segmentación tarifaria nacional.', 'El gobernador también firmó el decreto 50/23, por el que se ordenó la reducción del 30% del total facturado durante los meses de noviembre, diciembre, enero y febrero de cada año, para usuarias y usuarios ""de todas las categorías residenciales"" de los departamentos Anta, Orán, Rivadavia, San Martín, General Güemes y los municipios de La Candelaria, El Potrero y El Galpón. En el caso de las familias que cuenten con la tarifa social provincial, la reducción será equivalente al 50% del total facturado. ', 'La bonificación reglamentada en el decreto 50/23 no excluye a quienes perciben la tarifa social y tampoco a quienes se les aplican los beneficios provisionales otorgados por el decreto 38/23. Además, Sáenz pidió una tarifa plana para todo el país en la electricidad, el gas y el transporte, durante la visita que el presidente Alberto Fernández realizó al departamento La Poma en los primeros días de marzo.\xa0', 'Si bien el Ejecutivo provincial estableció las medidas recién mencionadas, Saravia dijo que en ellas ""no se plantean esquemas complementarios de cobro"", por lo que también se vieron obligados a ordenar a EDESA el no cobro de intereses moratorios. En el caso de que la empresa lo haya hecho, ahora deberá emitir una nota de crédito para retrotraerlo.\xa0', '""Creo que seguimos actuando en defensa de los usuarios, a pesar de algunas posturas interesadas"", dijo Saravia. El funcionario aseguró que algunos referentes del acampe estaban usando el reclamo en beneficio de candidaturas propias para los comicios provinciales del 14 de mayo. E insistió en la acción de la Gobernación, y afirmó que se hizo lo que ""tendría que haber hecho Nación"". Sin embargo, desde el acampe se cuestiona el mal funcionamiento de la empresa, pero también del Ente Regulador, al que acusan de que beneficia a la prestadora con medidas que se fueron tomando a lo largo de los años.\xa0', 'Por otro lado, Saravia cuestionó que los legisladores nacionales por Salta no exijan la aprobación inmediata de una ley de zonas cálidas. Hasta el momento,\xa0el senador nacional Sergio ""Oso"" Leavy, el diputado nacional Lucas Godoy y el ex legislador Andrés Zottos\xa0presentaron diferentes iniciativas en el Congreso de la Nación que impulsan el tratamiento de una norma que apruebe un régimen de cobro de tarifa diferenciada para los y las habitantes de las zonas cálidas del país, lo que beneficiaría a particularmente al norte salteño.\xa0', '""Son sólo tres proyectos los que tenemos que pechar porque Nación nos tiene que equiparar"" como se hizo con el régimen diferencia en zonas frías, afirmó Saravia, quien insistió en la necesidad de acelerar el proceso de aprobación después de conocer que se darán incrementos futuros en el cobro de la energía eléctrica. El funcionario aseguró que, de acuerdo a disposiciones del Fondo Monetario Internacional (FMI), ""van a aumentar el precio de abastecimiento y si hay más incremento, hay un problema con la gente que se pudo inscribir"" en la segmentación tarifaria que se llevó a cabo desde la Nación el año pasado.\xa0']"
Confirmaron casos de fiebre chikunguña en el sur de la provincia,2023-04-13T01:07:30-03:00,"Los casos se registraron en estos últimos días, sin antecedentes de viajes. ",Se contagiaron 9 personas de un mismo barrio en El Galpón,"['Chikunguña', 'El Galpón', 'Ministerio de Salud de Salta']","['Desde el Ministerio de Salud Pública de Salta se informó ayer que en el marco de la vigilancia intensificada por el brote de dengue que hay en la provincia, en la semana epidemiológica que se inició el domingo pasado, se confirmaron 9 casos de fiebre chikunguña. ', 'Los casos se registraron todos en personas que residen en un mismo barrio del municipio de El Galpón, en el departamento Metán. Ninguna de estas personas registra antecedentes de viaje y todas son de mediana edad, no presentan comorbilidades y se encuentran en buen estado de salud, bajo control médico y en sus viviendas.', 'Ante la novedad del evento, en la zona se realizaron las tareas pertinentes a los fines de evitar la propagación de la enfermedad y eliminar los reservorios de agua en los que pueden proliferar el mosquito aedes aegypti o el aedes albopictus, que transmiten el dengue y la fiebre chikunguña, respectivamente. Además, se hizo un bloqueo epidemiológico en el barrio y la búsqueda de personas contagiadas sintomáticas, particularmente con fiebre, como parte de la vigilancia sanitaria.', 'Se asumió que los nueve casos de fiebre chikunguña confirmados recientemente podrían estar vinculados a un primer registro de hace veinte días. Este se trata de un hombre que reside en la zona indicada, pero que en los días previos tenía antecedentes de viaje a la Ciudad de Buenos Aires y a la provincia de Santiago del Estero.', '\n', 'Para prevenir esta enfermedad se deben aplicar las mismas medidas que se recomiendan para evitar la propagación del dengue: eliminación de todos los reservorios de agua donde se depositan las larvas. Descacharrado y desmalezado en las casas. Uso de repelente, colocación de tela mosquitera en las ventanas y tules en las cunas y coches de bebés. Uso de ropa que permita una mayor protección del cuerpo. Ante la presencia de síntomas, particularmente de fiebre, inmediata consulta al médico. No automedicarse.']"
