title,date,lead,subtitle,tags,body
Pintar fotos antiguas para ahuyentar fantasmas,2023-04-11T00:15:42-03:00,Durante el encierro de la pandemia -y para mitigar sus efectos- el fotógrafo pintó sobre antiguas fotos ajenas. El resultado lo expuso en el Centro Borges y ahora lo publica en un libro.,Un nuevo libro del fotógrafo Marcos López,[],"['Por Marcos López *', 'Este libro se podría llamar ""El Pasado"" y el título funcionaria perfecto.', 'También se podría llamar ""Patria"" o ""La infancia"". Todo navegaría por el mismo río, ya que La Patria no es otra cosa que una ilusión de infancia. Y toda fotografía tiene que ver con el pasado. Hasta las selfis hechas con el teléfono. Atrapar el recuerdo. Un esfuerzo inútil por retener el tiempo. Caer en la trampa de la nostalgia. Se podría usar la palabra “Memoria"", pero no me quiero meter en líos, porque estoy tratando de alivianar el texto y la palabra memoria es una palabra compleja. También se podría llamar ""Mea Culpa"", y el texto de presentación sería el descargo ante un juez que me acusa, recriminándome qué derecho tengo yo de pintarrajear un diablo que sale de entre la falda del vestido de comunión de una niña, mientras ella lo ahorca con un gesto inexpresivo en su mirada, como si estuviera en el cielo rodeada de una corte de ángeles, o también, quién soy yo para pintarle unos cuernitos a un marido, en una fotografía de bodas, o para transformar el ramo de una novia en un yacaré anestesiado en sus tiernos brazos que están a punto de ponerlo en un recipiente especial para devolverlo a su hábitat natural, los Esteros del Iberá. Imagino mi postura corporal, bajando la cabeza 15 grados, mirando al suelo, y diciendo en voz alta, y clara, con valentía: ""Confieso que he pecado, señor Juez"". El problema con la fotografía, es que trabaja con ""La Realidad"", con una representación tan cercana a la realidad que se puede considerar la realidad misma.', 'Gente con nombre y apellido, retratadas en un estudio, con negativos y copias firmadas, con fechas, con el sello del estudio, dedicatorias a mano firmadas en el reverso... Al mismo tiempo, la pregunta sobre por qué esas fotos terminaron en la basura y en un aceitado circuito de comercialización: los cartoneros que las encuentran se las venden a los anticuarios o a los puesteros de los mercados de pulgas. ""También confieso que el hecho de comprarlas, de pagarlas, no me da derecho a pintarlas, señor Juez. Me declaro culpable.""', 'Y sin embargo, al mismo tiempo, al pintarlas, me atraviesa un sentimiento de placer, de sentir que estoy haciendo lo correcto, trabajando en mi oficio, que es reflexionar, redefinir, cuestionar, repensar costumbres, ceremonias, exorcizar sentimientos que marcaron mi personalidad y, a la vez, sirven para que el espectador se espeje y la imagen pueda ayudar a repensar cuestiones existenciales de nuestro paso por esta vida.', 'Así de simple y de complejo. También podría agregar en mi descargo ante el juez una frase final: ""Tenga en cuenta, señor juez, que está demostrado que las expresiones artísticas sirven como un alimento, son tan importantes como el oxígeno para ayudar a sobrellevar la vida cotidiana"". Y, finalmente, en ese momento me animo y lo miro a los ojos, ya sin culpa. Este sentimiento me paralizó muchas veces a punto de borrar, o romper algunas fotos, o dejarlas en cajones durante meses sin animarme a terminarlas.', 'De hecho, a algunas, las más arriesgadas, no me animé todavía a mostrarlas, y menos a publicarlas. El juego con la autocensura es uno de los ejes centrales de mi proceso en la creación de imágenes. La psicóloga me alentaba a seguir: ""No se reprima, Marcos, usted pinte, y luego me cuenta lo que le pasa, en la próxima sesión.""', '¿Qué pasa si los nietos, o bisnietos de esa niña, ahora una viejita de la edad de mi madre, la reconocen en el libro y se lo muestran?', '""Mirá abuela el diablo que te pintó este artista en tu foto de comunión."" ¿Cómo reaccionaría la señora viéndose a sí misma ahorcando a sus propios fantasmas, sus diablos, sus miedos, que seguramente la acompañaron en el camino de su vida?', '¿Cómo sigue la historia?', '""Con estas palabras termino mi alegato, señor Juez. Pido perdón y acepto la condena."" Y ya. Avancemos. Pasemos a otro tema.', 'Este libro también se podría llamar ""Debut y Despedida"", porque creo que con esta experiencia de pintar más de 100 fotos antiguas, tratando de aprovechar el encierro de la pandemia, haciendo una especie de laborterapia, o trabajo de autocuración para sobrellevar el miedo, el encierro, ya dije todo lo que tenía que decir pintando sobre fotos antiguas. Creo que si sigo me empezaré a repetir y me aburro. Me gustaría seguir pintando (de hecho lo estoy haciendo) pero directamente en óleo, o dibujando o pintando con acrílico sobre cartulina.', 'La muestra, la exposición que montamos en el Centro Cultural Borges, donde fueron expuestas la mayoría de las imágenes que componen este libro, se llamó ""Marcos López', '/ Clásico y Moderno"", y no tiene mucho sustento conceptual. Se me ocurrió nada más porque suena bien. Haciéndome el canchero. Es como decir: ""Puedo jugar de puntero derecho como René Orlando Housemann, también de 4 o de 3 como Silvio Marzolini en Boca Juniors o el Mariscal Perfumo en River Plate, o de 9 como Mario Alberto Kempes arrasando como una topadora en el eje central a los codazos, a los empujones, hasta meter el gol que nos hizo campeones del mundo en el Mundial 78."" Y sin quererlo, me puse a hablar del Mundial del 78 y sin nombrarla aparece la palabra memoria.', 'Memoria, verdad y justicia. Ni olvido ni perdón. A cuatro cuadras del estadio de River Plate donde el estadio entero gritaba ""Argentina, Argentina...!"" estaban torturando y dopando con somníferos a los detenidos, detenidas, para subirlos en los aviones de la muerte y tirarlos vivos al Río de la Plata. Algo de todo eso está también subyacente en este libro. En mi propia historia. En mis chistes. En mis silencios. No me explico por qué me puse a dar explicaciones sin que nadie me las pida.', 'Creo también que uno de los motivos por los que me puse a pintar fotos tiene que ver con que, desde hace un tiempo, estoy sintiendo que con la fotografía creo que llegué a un momento en el que me parece que ya dije todo lo que tenía que decir. Los temas, las situaciones que me interesan, trabajar sobre una reflexión sobre nuestra ""Identidad Cultural"" (con mayúsculas y entre comillas), creo que ya las hice. Además, siempre me gustó pintar. Y con la pandemia, la ecuación pintar fotos antiguas y quedarme adentro de mi casa fue una excusa perfecta, y cuando me di cuenta tenía una caja con más de 100 fotos pintadas. También creo que fue un trabajo de laborterapia. Estar ocupado. Poner los miedos y los fantasmas de toda la vida sumados al temor a la muerte que se respiraba en pandemia. Me veo pintando diablos, lenguas de monstruos medievales cuando se escuchaban los aplausos a los médicos que venían desde la calle. Los temas se repiten y son centrales en mi estructura emocional, cultural, de identidad, y que conforman una lista de traumas irresueltos.', 'Comuniones católicas, represión, miedo y el casamiento para toda la vida. La fotografía analógica y sus copias en papeles de plata gelatina tienen una fuerza energética, un aura y un misterio muy potente. Ya lo dije al principio.', 'Tienen un autor y aparece gente de verdad.', 'Ese conflicto creo que potencia el magnetismo que generan las imágenes. Siempre traté de ser transgresor con mi obra, y siempre lo viví con miedo y culpa. Creo que esos sentimientos están en estas fotos. Es mentira que uno exorciza los miedos al escribirlos o pintándole a un señor una corona transformándolo en el rey del coronavirus. Creo que las imágenes sirven para que el espectador se espeje y, con suerte, a veces se produce un aura mágica, un ir y venir, una empatía entre la obra y el espectador que ayuda a que el espectador respire hondo, y la situación ayuda a soportar el peso de la existencia. Otra cosa que me parece interesante es que todas las obras son originales. Objetos únicos. Tienen olor a químico. Son pinturas pero, al mismo tiempo, son fotografías. La mirada, el gesto de las manos, la ilusión sobreactuada de un retrato de estudio de una novia, por más cielos rosados flúo que yo le pinte atrás, cuchillos en las manos, leopardos, perros verdes... siguen teniendo la magia original de la fotografía. El ""hallazgo"", que es un acto, una acción propia de la mirada del fotógrafo, en este caso no es el click, ni el encuadre, sino el hecho de encontrar la foto entre los cajones desordenados de los anticuarios.', '* Fotógrafo. Prólogo del libro Intervenido, de Marcos López, que acaban de coeditar la Universidad Nacional del Litoral y La Universidad Nacional de las Artes.']"
De parte de la memoria emotiva de las cosas,2023-03-28T00:01:00-03:00,Un recorrido por aquellas cosas que han acompañado la vida familiar y social argentina. Cada visitante encontrará una historia entre las constelaciones de objetos.,"Del cielo a casa, exposición en el Malba",[],"['Se puede tomar un poco azarosamente como punto de partida el libro que Francis Ponge publicó en 1942, Le Parti pris des choses (que se tradujo como De parte de las cosas o Tomar partido por las cosas): en su poesía las cosas toman la palabra. La Segunda Guerra mundial era el paisaje trágico que en parte hizo que el poeta corriera su interés de lo humano hacia las cosas, para que estas tomaran la palabra y salieran de su estado mudo. En la búsqueda de darle voz a los objetos cotidianos, Ponge se mete en la lógica propia de las cosas, en su materialidad y su funcionamiento, hasta tal punto, que el hombre pasa a ser una cosa más.', 'Para seguir tentativamente por el mismo camino, una intensa rama de la filosofía política comenzó a proponer, en etapas de oscuridades más recientes, una cadena de solidaridades: una suerte de frente muy extenso que uniría lo humano con la naturaleza, los animales y las cosas para contrarrestar la depredación y la violencia antisolidaria del capitalismo avanzado.', 'En esa línea -aunque sin pretensiones ni altisonancia-, puede colocarse el libro de cuentos Del cielo a casa, de Hebe Uhart, que la escritora publicó hace veinte años y del cual se tomó el título para la gran exposición que en estos días se presenta en el Malba.', 'Hebe Uhart, sin teorizar, ejerció en la práctica una clara solidaridad con el mundo, con las personas, los lugares, los animales, las plantas y las cosas. En su obra la narración exhibe uno de los horizontes más democráticos de la literatura argentina, trazado por una escritura de mirada inteligente y oído absoluto para pescar tonos, registros, particularidades y así hacer hablar al mundo, siempre con picardía.', 'Aquel libro de 2003, editado por quien firma estas líneas, tiene una tapa realizada por Eduardo Stupía. Como puede verse en la foto inferior que acompaña esta nota, en la portada -compuestas con recortes de revistas de decoración de los años cincuenta y sesenta, se recompone una metáfora del título, en la que al carácter (celestial?) de una sala vacía se lo contrasta con el mismo espacio lleno de mobiliario y objetos. La sala, para volverse una casa (un hogar) se completa con las cosas que a través de sus diseños y funciones conforman en parte la vida cotidiana.', 'Podría pensarse que no solo en el título, sino también en los cuentos que lo componen y en la tapa (y en algunas frases del texto de la contratapa), es decir, en el libro todo, se anticipa buena parte del concepto que subyace a la exposición.', 'La muestra del Malba, con un despliegue casi inabarcable en una sola visita, exhibe constelaciones de objetos, obras de arte, tecnología, vehículos, mobiliario, videos, fotografías, documentos -todo hecho en Argentina- para generar sentidos y lecturas según se explica en el texto curatorial, en la búsqueda de un punto de vista etnográfico del abordaje de la cultura material: “El entramado de objetos, espacios de vida y obra, teje una red de sentido ampliada: nos conecta emocionalmente con lo propio a partir de una porción de ese archivo de la vida común en el que el diseño, el arte, la industria y la historia se hibridan. Nos convocan a viajar a un pasado cercano, para conjurar nuevamente los sucesos y anhelos de futuro que allí se inscribieron”.', 'La enorme cantidad de piezas incluidas en la exposición, provenientes de repertorios públicos y privados, cuidadosamente elegidas, de algún modo hablan también -ex profeso, no exhaustivamente- de una memoria social, política, económica, industrial, creativa.', 'Entre los centenares de objetos: mencionamos dos historias (que confluyen con el mes de la memoria) de objetos incluidos en la exposición. Por una parte la de las zapatillas flecha, un emblemático producto nacional, y la dirección de la flecha roja que simboliza la marca. Aquella flecha señalaba hacia la izquierda hasta que llegó la última dictadura y se produjo un giro hacia la derecha: dirección a la cual apunta la flecha desde entonces. La frase publicitaria era explícita: “Flecha va en tu mismo sentido”. Para sumar tragedia, las zapatillas flecha, que no estaban preparadas para el frío, fueron el calzado del que se proveyó en 1982 a los combatientes en el clima extremo de Malvinas, como parte del infinito maltrato. ', 'La segunda historia es la que está detrás (dentro) de cajas de alfajores Havanna como las exhibidas en la muestra. Aprovechando la imagen de producto regional (y nacional) fuera de toda sospecha, el escenógrafo Juan Lázaro transportó en 1979, en un doble fondo con filminas, imágenes a modo de hábeas corpus, para denunciar desapariciones. Las había preparado Chicha de Mariani, una de las fundadoras de Abuelas de Plaza de Mayo y, en París, Lázaro se las entregó a Elda y Ada D’Alessandro. Poco después, acompañó a Chicha y a otras abuelas a reunirse con Danielle Mitterrand, esposa del que sería presidente de Francia (entre 1981 y 1995), François Miterrand. La caja de alfajores sirvió como vehículo para denunciar internacionalmente el Terrorismo de Estado. ', '* La exposición Del cielo a casa, conexiones e intermitencias en la cultura material argentina, curada por Adamo Faiden, Leandro Chiappa, Gustavo Eandi, Carolina Muzi, Verónica Rossi, Juan Ruades, Martín Wolfson y Paula Zuccotti, sigue en el Malba (Figueroa Alcorta 3415) hasta el 12 de junio.']"
Homenaje plural para una artista múltiple,2023-03-21T09:14:28-03:00,Una antología de su obra visual; reinauguración del Museo que ahora lleva su nombre y publicación de la obra poética reunida.,Muestra de Niní Bernardello (1940-2020) en Río Grande,[],"['Desde Río Grande, Tierra del Fuego', 'En esta ciudad se están rindiendo una serie de bellos y potentes homenajes oficiales a la poeta, artista visual y docente Niní Bernardello (Cosquín, Córdoba, 1940-Río Grande, Tierra del Fuego, 2020): una exposición antológica de su obra plástica, la publicación de su obra poética reunida, y la reinauguracion del Museo Fueguino de Arte (MFA) con el nombre de Niní Bernardello; todo\xa0organizado por la Secretaría de Cultura, la Editora Cultural y la Dirección de Museos y Patrimonio del Ministerio de Educación, Cultura, Ciencia y Tecnología de Tierra del Fuego.', 'Conocí a Niní Bernardello en 2005, en el Proyecto Atmósferas, de la artista y gestora cultural Matilde Marín, organizado por el Complejo Cultural de Santa Cruz, en el Museo Cabo Vírgenes, frente al Estrecho de Magallanes, punto de convergencia de los océanos Atlántico y Pacífico. Ante ese paisaje deslumbrante, los invitados a aquel encuentro, desde la práctica artística, la crítica y la teoría, participamos de mesas sobre la producción y el pensamiento alrededor del arte y cultura de la región.', 'Como recordó Matilde Marín aquí el sábado, poco antes de la inauguración de la exposición “Nini Bernardello-Dibujando en el Horizonte” -que la tiene como curadora-, “Al finalizar las ponencias del Proyecto Atmósferas en Cabo Vírgenes, Niní tomó la palabra y leyó el poema ‘Atlántico’ que acababa de escribir en un cuaderno. Después nos contó sobre sus dibujos y pinturas”. ', 'En aquel encuentro empecé a conocer la obra visual de Niní, y a saber un poco más sobre su obra poética, que ahora la Editora Cultural de Tierra del Fuego acaba de reunir bajo el título Oficio, (se trata de su poesía édita entre 1980 y 2019) en un solo volumen de 600 páginas, compilado por Juan Fernando García y diseñado por Fabián Muggeri (quien también diseñó el sitio web www.ninibernardello.com.ar).', 'La trayectoria poética de Niní Bernardello está en sus libros, aún hallables en las librerías especializadas. Sobre su recorrido como artista visual se puede contar apretadamente que se formó en la ciudad de Córdoba y en su Cosquín natal. Desde fines de los años cincuenta participó y ganó una serie de premios (en dibujo, pintura y afiches) en salones de arte. A partir de los años sesenta realizó escenografías y murales (por ejemplo, en el marco del festival folclórico de Cosquín); continuó siendo seleccionada y premiada en importantes salones y empezó a exponer su obra individual y colectivamente. A principios de los setenta quedó marcada por la visita a la Bienal de San Pablo, luego de lo cual decidió vivir un tiempo en Brasil, durante 1973 y 1974. En 1975 se radicó en Buenos Aires y trabajó en el sello Melopea de Litto Nebbia, junto al músico y a Mirtha Defilpo. Trabajó con Carlota Beitia en la realización de escenografías teatrales. Diseñó las piezas de difusión e información del Festival de Rock de Cosquín. También incursionó en el cine, en la realización de cortometrajes. ', 'En 1981, junto a su compañera Maribé Achaga (discreta factótum de todo este homenaje), fija su residencia en Río Grande, donde a través de todos estos años produjo un enorme impacto en la educación, la literatura y las artes visuales locales. Entre otras cosas, su militancia artística fue crucial para la existencia y permanencia del MFA, fundado hace once años. El impacto de Niní Bernardello resulta evidente en estos días, en los relatos, anécdotas y situaciones contadas tanto al calor de la multitudinaria inauguración de la muestra antológica del sábado (día de su cumpleaños) en el Museo que ahora lleva su nombre; como en la presentación de su obra reunida, anteayer, por parte de Diana Bellessi, Juan Francisco García, Fabián Muggeri y Maribé Achaga.', 'La exposición reúne -gracias al trabajo de archivo y catalogación de Maxi López y Laura Llovera- unas setenta piezas - y lleva el subtítulo “Obra mútliple”, revelador de la capacidad de búsqueda y experimentación de la artista: pinturas, dibujos, collages, grabados, fotos, diseños (de tapas de discos de Litto Nebbia). En toda su obra se ve una técnica depurada, un trabajo minucioso con las texturas y el color; y diversos planteos alrededor de la forma que en parte la acercan a la genealogía surrealista. Allí subyacen sus recuerdos, amores, temores, paisajes -entre otras evocaciones-, transformados en figuras, colores, estampas y montajes.', 'Diana Bellessi recuerda en un texto incluido en la obra poética reunida -que reproduce lo que leyó en la presentación del último libro de Bernardello, Atardeceres marinos, en Buenos Aires, en febrero de 2020-: “Éramos adolescentes cuando nos encontramos un verano en Cosquín y la voz de la Negra Sosa en el Festival de Folklore selló nuestra amistad para siempre. Bernardello estaba tocada por el expresionismo y yo por el romanticismo del siglo diecinueve. El aura dorada y oscura del expresionismo romántico roza todas las páginas de este libro, quizás uno de los más hermosos que escribiera la autora. Para oírlo, para verlo. Como dice Juan Fernando García, repitiendo el último verso de un poema de Nini: es ""mítico, irreal, antiguo”.', 'La frase que da título a la exposición está tomada de un poema de N.B., quien escribe sobre su poética en dos fragmentos -tomados de Oficio-: “Durante años, alternativamente, pinté, dibujé, hice fotografías y escribí poesía. (…) Como en el arte de la cartomancia, elegir unas cartas y no otras, conferirán a estas nuevos sentidos y significaciones”.', 'La exposición antológica en el Museo Fueguino de Arte Niní Bernardello, sigue hasta mediados de mayo.']"
