title,date,lead,subtitle,tags,body
Brasil: intiman a Twitter a bloquear contenidos que incitan a la violencia en escuelas,2023-04-13T00:01:00-03:00,El gobierno de Lula y la justicia reaccionaron a una ola de mensajes de odio aparecidos en Internet y el crimen de cuatro niños en un jardín de infantes de Blumenau.,"La fiscalía investiga el rol de las redes ""frente a las noticias falsas y la violencia digital""","['Brasil', 'Luiz Inácio Lula da Silva', 'masacres', 'escuelas']","['La fiscalía federal de Brasil pidió en carácter de urgente a la sede local de Twitter respuestas sobre si estaba adoptando medidas para moderar aquellos mensajes que incitan a los adolescentes a la violencia en las escuelas. En medio de una ola de ataques que preocupa a las autoridades, este miércoles un adolescente de 14 años y sus padres fueron detenidos acusados de terrorismo por apología del nazismo y porque el menor había planificado, con mensajes en redes sociales, un ataque a una escuela de la ciudad de Maquiné, en el estado de Río Grande do Sul.', '""Enfrentar la desinformación y la violencia""', 'La fiscalía brasileña informó que el pedido a Twitter fue para ""evaluar la eventual responsabilidad de la plataforma por violaciones de derechos fundamentales que puedan derivarse de la constatación de deficiencias en su política para enfrentar la desinformación socialmente dañina y la violencia en el mundo digital"". El gobierno de Luiz Inácio Lula da Silva teme una ola de ataques en medio de un clima de amenazas digitales luego de que un hombre de 25 años, Luiz Lima, un repositor de supermercado sospechoso de vínculos con grupos neonazis, matara con un hacha a cuatro niños en un jardín de infantes de Blumenau, en el sureño estado de Santa Catarina.', 'Twitter, que fue adquirida por el magnate Elon Musk, cambió sus políticas públicas, y sus abogados dijeron al ministro de Justicia, Flavio Dino, que no pretendían, en nombre de la libertad de expresión, eliminar contenidos que convocaban a cometer masacres en escuelas. Según el diario Folha de Sao Paulo, la oficina de prensa de Twitter fue desmontada en Brasil y responde con el emoji de un excremento a los pedidos de información, tal como habitualmente realiza Musk en sus publicaciones en la red social.', 'La plataformas chinas Kwai y TikTok y las estadounidenses Google, Meta y WhatsApp presentaron una serie de medidas para diferenciarse de Twitter y combatir la ola de pánico que grupos nazis y de extrema derecha están generando en las redes y en las escuelas. Para prevenir nuevos ataques contra escuelas, el ministerio de Justicia y Seguridad Pública de Brasil lanzó la plataforma digital ""Escola Segura"", que permite a cualquier persona denunciar de forma anónima posibles amenazas y ataques.\xa0', 'Después de reunirse el lunes con representantes de redes sociales, Flavio Dino sostuvo que el gobierno todavía no puedo identificar ""la proporcionalidad de la reacción de las plataformas con esta epidemia de violencia que amenaza en este momento a nuestras escuelas"".\xa0""Dejé en claro en la reunión que si no se hace caso a la notificación, tomaremos acciones policiales y legales contra las plataformas"", planteó el ministro de Justicia. Su cartera identificó 511 perfiles con difusión de contenidos violentos contra las escuelas, los días ocho y nueve de abril, solamente en Twitter.', 'El martes tres alumnos resultaron heridos en un ataque perpetrado por un estudiante de 13 años en una escuela pública secundaria en Santa Tereza, estado de Goias. El adolescente arrojó un petardo en un aula, esperó a que sus compañeros salieran al pasillo por el estruendo y arremetió contra ellos con un cuchillo. El atacante persiguió luego a una profesora, que se encerró en un aula. Finalmente, el agresor fue reducido por un trabajador de limpieza y entregado a las autoridades.\xa0', 'El de Goias fue el segundo ataque en 24 horas en Brasil: el lunes un adolescente atacó a cuchillazos a una profesora y dos alumnos de una escuela privada\xa0en Manaos, capital de Amazonas. El miércoles pasado cuatro niños de entre cuatro y siete años fueron asesinados en una escuela de la localidad de Blumenau, estado de\xa0Santa Catarina, cuando un hombre irrumpió en una guardería y los atacó con un hacha.', 'Los asesinatos generaron conmoción en el gigante sudamericano así como un clima de ""pánico instalado en el seno de las escuelas y familias"", según el ministro de Justicia, Flavio Dino. La preocupación se trasladó en los últimos días a las redes sociales y también a grupos de padres de Whatsapp.', 'Usuarios de esas redes especulan con que el 20 de abril, aniversario de la masacre de Columbine, donde en 1999 un profesor y 12 estudiantes fallecieron en Estados Unidos víctimas de un atentado con explosivos, se producirán nuevos hechos de violencia en el país. ""Consiga un certificado médico y haga prevención, no vaya a la escuela ese día"", alertó una usuaria en un video viralizado en redes.', 'Este miércoles un adolescente de 14 años y sus padres fueron detenidos por apología del nazismo y por planificar el ataque a una escuela en el estado de Río Grande do Sul, fronterizo con las provincias de Corrientes y Misiones. La operación policial se realizó a partir de un trabajo de inteligencia en las redes sociales.', 'El comisario Marco Souza informó a la prensa que los padres fueron detenidos porque se consideró que no podían desconocer lo que estaba ocurriendo con todo el material nazi que el adolescente tenía en su cuarto. La policía allanó la vivienda de la familia luego de detectar que el adolescente planeaba atacar una escuela de Maquiné, a 130 kilómetros de Porto Alegre, con otro adolescente residente en el estado de Paraná, también en el sur de Brasil.', 'Una bandera nazi que fue confiscada había sido regalada por el padre al hijo en su cumpleaños, dijo el comisario Souza. En la casa de la familia ""gaúcha"", como se les dice a los oriundos de Río Grande do Sul, se encontraron pancartas y banderas con las caras de los dictadores Adolf Hitler y Benito Mussolini, además de armas de fuego falsas.']"
Cruces entre Kiev y Moscú frente a un video de un soldado ucraniano decapitado,2023-04-13T00:01:00-03:00,"Rusia, que normalmente rechaza este tipo de acusaciones, llamó a comprobar si la grabación del crimen del prisionero de guerra era real. ","El presidente Volodimir Zelenski tachó a los rusos de ""bestias""","['Conflicto Rusia Ucrania', 'Volodimir Zelenski']","['El presidente de Ucrania, Volodimir Zelenski, calificó a los rusos de ""bestias"" tras la difusión de un video con la supuesta decapitación de un prisionero de guerra ucraniano, que provocó la indignación de la ONU y la Unión Europea. El Kremlin, por su parte, tomó la noticia con cautela y dijo que la filmación debe ser ""verificada"".', '""¡Con qué facilidad matan estas bestias! Este video de la ejecución de un prisionero de guerra ucraniano, el mundo debe verlo. Este es un video de Rusia tal y como es"", dijo Zelenski en un mensaje en Instagram. ""Esto no es un accidente. Esto ya había pasado antes. Así era en Bucha. Miles de veces"", agregó el mandatario en alusión a la ciudad de Kiev que se convirtió en un símbolo de las matanzas atribuidas al Ejército ruso.', 'El ministro ucraniano de Relaciones Exteriores, Dmitro Kuleba, consideró que Rusia era ""peor que el Estado Islámico"", organización yihadista que solía filmar las ejecuciones de sus rehenes, en general por decapitación. ""Los terroristas rusos deben ser expulsados de Ucrania y de la ONU y responsabilizados de sus crímenes"", reiteró.', 'En el video, que dura un minuto y 40 segundos y circula por las redes desde el martes, se ve a un hombre con ropa de camuflaje y la cara tapada cortándole el cuello a otro, vestido de uniforme, tendido en el suelo y gritando: ""¡Esto duele!"". Al cabo de unos segundos, los gritos terminan y se escucha a un hombre detrás de la cámara incitando en ruso al verdugo a ""cortarle la cabeza"".\xa0', 'El hombre termina la decapitación con un cuchillo y al final, muestra la cabeza a la cámara. ""Hay que meterla en una bolsa y enviársela al comandante"", dice una voz en ruso. La cámara también enfoca el chaleco de la víctima, que lleva el tridente del escudo ucraniano y una calavera.', 'El servicio ucraniano de seguridad (SBU) abrió una investigación sobre este ""crimen de guerra"". ""Encontraremos a estos monstruos. Serán castigados"", aseguró su responsable,\xa0Vassyl Maliuk. La viceministra de Defensa, Ganna Maliar, indicó que las autoridades están ""haciendo todo lo posible para identificar al fallecido"".\xa0', 'Rusia, que normalmente rechaza las acusaciones de crímenes contra sus militares y acusa a Kiev de falsear los hechos, llamó comprobar si la grabación era real. ""Por supuesto se trata de imágenes horribles"", dijo a la prensa el vocero de la presidencia rusa, Dmitri Peskov. Pero ""en el mundo de fake news en el que vivimos, la autenticidad de este video debe ser verificada"", agregó Peskov.\xa0', 'La misión de la ONU en Kiev dijo estar ""horrorizada"" por estas imágenes y mencionó una segunda grabación en la que se ven ""cuerpos mutilados, aparentemente de prisioneros de guerra ucranianos"". ""Desgraciadamente no es un incidente aislado"", lamentó la misión, reclamando investigar los hechos y llevar a sus autores ante la justicia.', 'La Unión Europea (UE) también exigió que rindan cuentas ""todos los autores y cómplices de crímenes de guerra"" en Ucrania. Si la grabación es cierta, ""se trata de un nuevo recordatorio brutal de la naturaleza inhumana de la agresión rusa"", en palabras de Nabila Massrali, la portavoz del jefe de la diplomacia europea, Josep Borrell.\xa0', 'Desde que empezó el ataque ruso en Ucrania, en febrero de 2022, Kiev y Moscú se han acusado mutuamente de crímenes de guerra. A principios de marzo, un video mostrando una supuesta ejecución de un prisionero de guerra ucraniano a manos de soldados rusos causó conmoción en Ucrania. En noviembre, el Kremlin se enfureció con dos grabaciones en las que se veía la presunta ejecución de una decena de militares rusos que acababan de rendirse.']"
Coctelería molecular: investigadoras preparan tragos y contribuyen a la divulgación científica  ,2023-04-10T23:30:19-03:00,"A través de la física y la química, científicas de la Universidad Nacional de Quilmes proponen una nueva forma de consumir bebidas tradicionales. También realizan talleres gratuitos para que las infancias aprendan a través del juego y la experimentación. ",La fórmula para beber y conocer,"['Universidad Nacional de Quilmes', 'Divulgación científica']","['Especialistas de la Universidad Nacional de Quilmes (UNQ) llevan adelante una barra de tragos en la que se pueden encontrar bebidas tradicionales como el fernet, el mojito y el daiquiri, pero diseñados con principios de química molecular. Se trata de deconstruir la coctelería habitual y observar el detrás de escena científico de cada trago, esto es, evaluar qué sustancia espuma más, de qué manera se tiñen o qué textura utilizan. ', 'Anahí Cuellas, investigadora e impulsora del proyecto presentado en la UNQ en 2014, cuenta: “Separamos los ingredientes de un trago normal, como un gin tonic, y les aplicamos un proceso de física y química. Hacemos una encapsulación de pepino, una esfera gelificada de gin tonic y agregamos una espuma de limón”. Las distintas texturas se conjugan en una misma copa y, de esta manera, logran que la persona experimente una relación sensorial diferente a la que está acostumbrada.', 'Con el objetivo de que las bebidas despierten todos los sentidos, el equipo aplica la esferificación para la obtención de perlas de diferentes tamaños que encierran en su interior distintos componentes del trago. Estas bolas de gelatina hacen que los sabores aparezcan repentinamente en la boca. También utilizan emulsionantes, como la lecitina de soja, para unir dos elementos que no se mezclan, como el agua y el aceite.', 'Además, se combinan texturas a través del nitrógeno líquido, un fluido utilizado para enfriar y conservar productos alimenticios. Mediante este proceso, se congela la parte exterior del trago y se deja a temperatura ambiente su interior, provocando sensaciones de frío y calor.', 'La barra tecnológica forma parte de lo que se conoce como gastronomía molecular. Así lo explica Cuellas: “En los laboratorios, a través de la ciencia, desarrollamos alimentos funcionales. Por ejemplo, si queremos que tenga determinada textura, un mineral o una vitamina en particular, usamos técnicas de encapsulación para lograr que eso se preserve dentro del proceso de formulación y desarrollo industrial”. Es decir, los tragos moleculares no solo son visualmente llamativos, sino también son nutritivos para el cuerpo humano.', 'La barra se mueve en base a dos principios: el de la divulgación científica y el de la curiosidad del público. En esta línea, el equipo busca todas las maneras para comunicar ciencia, incluso desde los nombres de los tragos.', ""“Una vez hicimos el desarrollo de una barra afrodisíaca y teníamos un aperitivo con limón al que llamamos 'Espuma de Afrodita'. En la barra científica jugamos con personajes y teorías como 'Pasión de Arquímedes', 'Protones y neutrones', 'Constelaciones moleculares' o 'Big Bang'. Ponemos nombres que invitan a preguntar de qué se tratan estos conceptos, quién fue Arquímedes o qué dice el principio de incertidumbre”, narra Cuellas."", 'Lejos de que estos saberes queden al interior del laboratorio, la científica apuesta a su divulgación a través de una manera divertida y, de esta forma, acortar la brecha entre ciencia y sociedad. Junto con su equipo realizan cursos y talleres para las infancias que aprenden principios de física y química de un modo lúdico mientras practican experimentos y mezclas. ', 'Durante la última temporada, la barra molecular estuvo presente en Tecnópolis con venta de tragos, helados y cereales crujientes con nitrógeno líquido a un precio accesible. También, ofrecieron dos talleres gratuitos diarios para elaborar distintas bebidas junto con los más chicos.', 'Asimismo, el equipo realizó una barra temática sobre mujeres pioneras en la celebración del Día Internacional de la Niña y Mujer en la Ciencia. “Diseñamos tragos que tenían una estética y respondían a esas mujeres. Por ejemplo, en el caso de la estación de Las cuatro de Melchior (que fueron las científicas argentinas que llegaron a la Antártida), hicimos una barra con espuma y con nitrógeno líquido para simular el continente blanco y contábamos su historia”, recuerda Cuellas.', 'En dicha oportunidad también se homenajeó a Hildebranda Ángela Castellaro, una paleontóloga especializada en invertebrados y participante de una de las obras más importantes de esta ciencia en el país: “Los trilobites Ordovicicos de la Argentina”. En esa estación, los tragos se hicieron con la técnica de esferas inversas y se presentaron en fósiles realizados en impresión 3D.', 'En definitiva, se trata de un proyecto que descubre los secretos de la ciencia y los comparte con la comunidad.']"
Especialistas realizaron un censo para estimar la población de una especie de ballena en peligro de extinción,2023-04-10T23:30:45-03:00,Científicos de Chubut contabilizaron cerca de 2700 ejemplares. Por culpa de la caza había poca información sobre este cetáceo que volvió al Golfo San Jorge.,Se trata de la tercera más grande del mundo,"['Conicet', 'Chubut']","['Investigadores del Conicet y la Universidad Nacional de la Patagonia San Juan Bosco realizaron un censo poblacional de ballenas Sei luego de reportar varios avistamientos en las playas de Rada Tilly, provincia de Chubut, en los últimos años. Se trata de la tercera ballena más grande del mundo, que llega a medir unos 18 metros y puede pesar hasta 30 toneladas. Para lograr el objetivo, realizaron una serie de vuelos sobre la zona costera del Golfo San Jorge. Por culpa de la caza, que tuvo su apogeo a partir del siglo XIX, estuvo al borde de la extinción y es por eso que no se tiene mucha información sobre ella. Al día de hoy, la Unión internacional para la Conservación de la Naturaleza la considera en peligro. ', '“Durante los últimos 100 años no se observaron muchos ejemplares. Si bien los registros históricos daban cuenta que esta ballena estaba acá antes de las cacerías, sorprende muchísimo el número y la frecuencia con la que están apareciendo en la actualidad”, comenta Mariano Coscarella, investigador del Conicet en el Centro para el Estudio de Sistemas Marinos.', '“Nos llamó la atención que hubiese tantas de estas ballenas en la región, pero entendimos por qué llegan aquí una vez que comenzamos a estudiar su comportamiento”, explica el científico. El Golfo San Jorge es una zona productiva y a partir de marzo hay mucha langostilla, un pequeño crustáceo del que se alimentan las Sei.\xa0Además, aclara: “No hemos visto cópulas ni nacimientos. No es una zona donde vengan a parir, pero sí vienen a comer en esta época del año. Tienen una forma de alimentarse que se denomina por embestida; el animal abre la boca y se le amplía la garganta. Pudimos observar grupos de hasta 10 ballenas comiendo simultáneamente sobre el mismo cardumen”.', 'A su vez, la reaparición de esta especie obligó al equipo de trabajo a reorientar su investigación habitual. Una de las nuevas preguntas que surgió tiene que ver con los lazos biológicos y familiares de otras Sei que habitan sitios cercanos. “No sabemos si son las mismas que están en la Antártida o en Chile. Probablemente se relacionen con las que están en Malvinas y en la costa de Tierra del Fuego, porque empezaron a aparecer en esas regiones más o menos al mismo tiempo que comenzaron a visitar nuestras costas”, detalla.', 'El Área Natural Protegida Punta Marqués se encuentra en el extremo sureste de la provincia de Chubut, al sur de la localidad de Rada Tilly, y está situada en la zona central del Golfo San Jorge. Hasta allí llegan muchas especies de cetáceos como toninas overas, delfines oscuros, delfines nariz de botella, delfines grises, cachalotes, ballenas azules y jorobadas.', 'Sin embargo, el investigador destaca que la más abundante de todas es la ballena Sei. “Se las puede ver prácticamente todo el año, salvo entre julio y septiembre que casi no hay. A partir de ahí, pueden observarse cada vez con más frecuencia y alcanzan su máximo en mayo. Llegamos a contar 70 ejemplares en un mismo sitio, a simple vista”, describe.', 'El período del año en que esta ballena visita la región hace que Chubut ocupe un lugar de privilegio desde el punto de vista del turismo de naturaleza. En los meses en que la frecuencia de avistajes de Sei empieza a mermar, a 450 kilómetros de distancia, en la ciudad de Puerto Madryn comienza el apogeo de visita de la Ballena Franca. Así, la provincia cuenta con estos animales fabulosos todo el año.', 'Según indica Coscarella, a partir del análisis de registros y documentos de época, entre finales del siglo XIX y principios del XX, se estima que unas 100 mil Sei fueron cazadas en todo el mundo. Las ballenas y otros animales marinos, como lobos y elefantes, fueron explotados durante muchísimos años, porque su grasa tenía un alto interés comercial y se usaba, entre otras cosas, en lámparas de aceite. ', 'Con el paso de los años, a medida que la tecnología y las artes de caza fueron mejorando, la cantidad de ballenas capturadas se incrementó al punto que, en diferentes épocas, distintas especies estuvieron al borde de la extinción. Tras la firma de la Convención Internacional para la Regulación de la Caza de Ballenas en 1946 y las políticas de moratoria en la caza implementadas en 1986 por la Comisión Ballenera Internacional (sumadas a leyes y políticas públicas nacionales) algunas especies de ballena, como la Sei, recuperaron en mayor o menor grado sus poblaciones. Disponer de un censo es clave: después de todo, contar también es conocer.\xa0']"
Científicas diseñan una galletita saludable de alta calidad nutricional,2023-04-10T23:30:57-03:00,"El alimento será a base de semillas, garbanzos, harina de trigo y polvo de tomate. Se trata de una opción sana frente a los ultraprocesados. Argentina es uno de los países que más galletas y bizcochos consume en el mundo.",Se espera que salga al mercado antes de 2024,"['Ultraprocesados', 'Alimentación Saludable']","['Científicas del Centro de Investigación y Desarrollo en Criotecnología de Alimentos (CIDCA-Conicet) desarrollan galletitas saludables como una alternativa frente al consumo de ultraprocesados de baja calidad nutricional. El snack será a base de amaranto, chía, harina de trigo y garbanzo, y polvo de tomate. El objetivo es crear un alimento sano para el consumidor que contenga proteínas, fibras, vitaminas, moléculas prebióticas, péptidos bioactivos, polifenoles con efecto antioxidante y licopeno. Ya se hicieron las pruebas iniciales y se espera que, antes de fin de año, el producto salga al mercado.', 'Argentina registra uno de los consumos más altos de galletitas y bizcochos a nivel mundial. Según las diferentes estadísticas, en el país se comen entre 9,5 y 12 kilos por persona cada año. Aunque no es uno de los principales exportadores, sí se encuentra entre los primeros diez que más volumen producen en todo el planeta. A su vez, en una mezcla de hábitos culturales y facilidades para la elaboración, la balanza se inclina a favor de las galletas dulces por sobre las saladas. ', 'El problema es que esas galletitas y bizcochos son ultraprocesados, es decir que intervienen muchos procesos químicos en su elaboración (conservantes, colorantes y aromatizantes, entre otros) y su calidad nutricional es baja: contienen azúcares, grasas, colesterol y sodio en exceso. ', 'Su consumo cotidiano se asocia a un mayor riesgo de aparición de enfermedades no transmisibles, factores de riesgo metabólicos como obesidad, hipertensión y diabetes; así como también, a enfermedad renal crónica, cáncer y enfermedades cardio y cerebrovasculares. En este sentido, la sanción de la Ley de Promoción de Alimentación Saludable en 2021, más conocida como Ley de Etiquetado Frontal, prevé ayudar a los consumidores a reconocer este tipo de alimentos y advertir sobre su consumo.', 'Ante esta situación, especialistas del CIDCA diseñan una galletita seca tipo snack que no solo es saludable, sino también rica y apetecible para el paladar. De esta manera, las investigadoras proponen un alimento que ayuda a prevenir algunas de las enfermedades que promueven los ultraprocesados. ', 'Por ejemplo, el amaranto aporta proteínas y péptidos --fracciones de proteínas que tienen propiedades antitumorales y antihipertensivas--, la chía agrega proteínas, antioxidantes, ácidos grasos insaturados y fibra, el garbanzo y la harina de trigo también son fuente de proteínas, y el tomate en polvo incorpora antioxidantes, vitaminas, fibras y lípidos. ', 'Una vez finalizado, el producto será transferido a la empresa Don Campostrini para fabricarlo a escala industrial y comercializarlo. La idea es que la vida útil de la galletita en la góndola sea de seis meses.']"
